<?xml version="1.0" encoding="UTF-8"?>
<!DOCTYPE workflow-forms PUBLIC "-//OpenKM//DTD Workflow Forms 1.1//EN"
                                "http://www.openkm.com/dtd/workflow-forms-1.1.dtd">
<workflow-forms>
  <workflow-form task="start">
  	<input label="Quantity" name="quantity" value="10"/>
  	<button name="save" label="Save" />
  </workflow-form>
  <workflow-form task="user_info">
    <input label="Name" type="text" name="name" value="John" />
    <input label="Surname" type="text" name="surname" value="Doe" />
    <textarea label="Info" name="info" value=""/>
    <select label="Type" name="type" type="simple">
      <option label="Type 1" value="t1" />
      <option label="Type 2" value="t2" selected="true" />
      <option label="Type 3" value="t3" />
    </select>
    <button name="goto_1" label="Goto 1" value="route 1" type="transition" />
    <button name="goto_2" label="Goto 2" value="route 2" type="transition" />
  </workflow-form>
</workflow-forms>
